[
  {
    "id": "demo-relay-alpha",
    "name": "Demo Relay Alpha",
    "website": "https://example.com/alpha",
    "summary": "示例中转站 Alpha，仅用于开发演示。",
    "status": "active",
    "rankWeight": 40,
    "authenticityStatus": "pass",
    "priceLevel": [
      "low",
      "mid"
    ],
    "payments": [
      "alipay",
      "wechat"
    ],
    "minTopupCny": 1,
    "giftDescription": "注册送体验额度",
    "invoiceSupport": "conditional",
    "invoiceNote": "200 元起开电子发票",
    "stabilityScore": "excellent",
    "imageModelSupport": true,
    "channelType": "mixed",
    "channelNote": "",
    "affiliateDisclosure": null,
    "lastVerifiedAt": "2026-07-17T10:00:00Z",
    "lastPriceUpdatedAt": "2026-07-16T08:00:00Z",
    "listedAt": "2026-07-01T00:00:00Z",
    "promoCodes": []
  },
  {
    "id": "demo-relay-beta",
    "name": "Demo Relay Beta",
    "website": "https://example.com/beta",
    "summary": "示例中转站 Beta，仅用于开发演示。",
    "status": "active",
    "rankWeight": 45,
    "authenticityStatus": "pass",
    "priceLevel": [
      "mid"
    ],
    "payments": [
      "alipay",
      "usdt"
    ],
    "minTopupCny": 10,
    "giftDescription": "—",
    "invoiceSupport": "no",
    "invoiceNote": "",
    "stabilityScore": "fair",
    "imageModelSupport": false,
    "channelType": "unknown",
    "channelNote": "",
    "affiliateDisclosure": null,
    "lastVerifiedAt": "2026-07-10T12:00:00Z",
    "lastPriceUpdatedAt": "2026-07-16T08:00:00Z",
    "listedAt": "2026-07-01T00:00:00Z",
    "promoCodes": []
  },
  {
    "id": "demo-relay-gamma",
    "name": "Demo Relay Gamma",
    "website": "https://example.com/gamma",
    "summary": "示例中转站 Gamma，仅用于开发演示。",
    "status": "active",
    "rankWeight": 50,
    "authenticityStatus": "unknown",
    "priceLevel": [
      "high"
    ],
    "payments": [
      "wechat"
    ],
    "minTopupCny": 5,
    "giftDescription": "—",
    "invoiceSupport": "yes",
    "invoiceNote": "",
    "stabilityScore": "unknown",
    "imageModelSupport": true,
    "channelType": "official",
    "channelNote": "",
    "affiliateDisclosure": null,
    "lastVerifiedAt": "2026-07-16T08:00:00Z",
    "lastPriceUpdatedAt": "2026-07-16T08:00:00Z",
    "listedAt": "2026-07-01T00:00:00Z",
    "promoCodes": []
  },
  {
    "id": "demo-relay-delta",
    "name": "Demo Relay Delta",
    "website": "https://example.com/delta",
    "summary": "示例中转站 Delta，仅用于开发演示。",
    "status": "active",
    "rankWeight": 55,
    "authenticityStatus": "pass",
    "priceLevel": [
      "low"
    ],
    "payments": [
      "alipay",
      "wechat",
      "usdt"
    ],
    "minTopupCny": 1,
    "giftDescription": "注册送体验额度",
    "invoiceSupport": "conditional",
    "invoiceNote": "",
    "stabilityScore": "excellent",
    "imageModelSupport": false,
    "channelType": "mixed",
    "channelNote": "",
    "affiliateDisclosure": null,
    "lastVerifiedAt": "2026-07-15T08:00:00Z",
    "lastPriceUpdatedAt": "2026-07-16T08:00:00Z",
    "listedAt": "2026-07-01T00:00:00Z",
    "promoCodes": []
  },
  {
    "id": "demo-relay-epsilon",
    "name": "Demo Relay Epsilon",
    "website": "https://example.com/epsilon",
    "summary": "示例中转站 Epsilon，仅用于开发演示。",
    "status": "active",
    "rankWeight": 60,
    "authenticityStatus": "fail",
    "priceLevel": [
      "mid",
      "high"
    ],
    "payments": [
      "paypal",
      "stripe"
    ],
    "minTopupCny": 20,
    "giftDescription": "—",
    "invoiceSupport": "no",
    "invoiceNote": "200 元起开电子发票",
    "stabilityScore": "poor",
    "imageModelSupport": true,
    "channelType": "reverse_suspected",
    "channelNote": "通道存在用户反馈风险，仅供参考",
    "affiliateDisclosure": null,
    "lastVerifiedAt": "2026-06-01T08:00:00Z",
    "lastPriceUpdatedAt": "2026-07-16T08:00:00Z",
    "listedAt": "2026-07-01T00:00:00Z",
    "promoCodes": []
  },
  {
    "id": "demo-relay-zeta",
    "name": "Demo Relay Zeta",
    "website": "https://example.com/zeta",
    "summary": "示例中转站 Zeta，仅用于开发演示。",
    "status": "active",
    "rankWeight": 65,
    "authenticityStatus": "pass",
    "priceLevel": [
      "low",
      "mid"
    ],
    "payments": [
      "alipay"
    ],
    "minTopupCny": 1,
    "giftDescription": "—",
    "invoiceSupport": "yes",
    "invoiceNote": "",
    "stabilityScore": "fair",
    "imageModelSupport": false,
    "channelType": "unknown",
    "channelNote": "",
    "affiliateDisclosure": null,
    "lastVerifiedAt": "2026-07-14T08:00:00Z",
    "lastPriceUpdatedAt": "2026-07-16T08:00:00Z",
    "listedAt": "2026-07-01T00:00:00Z",
    "promoCodes": []
  },
  {
    "id": "demo-relay-eta",
    "name": "Demo Relay Eta",
    "website": "https://example.com/eta",
    "summary": "示例中转站 Eta，仅用于开发演示。",
    "status": "active",
    "rankWeight": 40,
    "authenticityStatus": "unknown",
    "priceLevel": [
      "mid"
    ],
    "payments": [
      "usdt",
      "card"
    ],
    "minTopupCny": 50,
    "giftDescription": "注册送体验额度",
    "invoiceSupport": "no",
    "invoiceNote": "",
    "stabilityScore": "excellent",
    "imageModelSupport": true,
    "channelType": "mixed",
    "channelNote": "",
    "affiliateDisclosure": null,
    "lastVerifiedAt": "2026-07-13T08:00:00Z",
    "lastPriceUpdatedAt": "2026-07-16T08:00:00Z",
    "listedAt": "2026-07-01T00:00:00Z",
    "promoCodes": []
  },
  {
    "id": "demo-relay-theta",
    "name": "Demo Relay Theta",
    "website": "https://example.com/theta",
    "summary": "示例中转站 Theta，仅用于开发演示。",
    "status": "active",
    "rankWeight": 45,
    "authenticityStatus": "pass",
    "priceLevel": [
      "low"
    ],
    "payments": [
      "alipay",
      "wechat"
    ],
    "minTopupCny": 1,
    "giftDescription": "—",
    "invoiceSupport": "conditional",
    "invoiceNote": "",
    "stabilityScore": "fair",
    "imageModelSupport": false,
    "channelType": "official",
    "channelNote": "",
    "affiliateDisclosure": null,
    "lastVerifiedAt": "2026-07-12T08:00:00Z",
    "lastPriceUpdatedAt": "2026-07-16T08:00:00Z",
    "listedAt": "2026-07-01T00:00:00Z",
    "promoCodes": []
  },
  {
    "id": "demo-relay-iota",
    "name": "Demo Relay Iota",
    "website": "https://example.com/iota",
    "summary": "示例中转站 Iota，仅用于开发演示。",
    "status": "active",
    "rankWeight": 50,
    "authenticityStatus": "pass",
    "priceLevel": [
      "high"
    ],
    "payments": [
      "wechat",
      "usdt"
    ],
    "minTopupCny": 10,
    "giftDescription": "—",
    "invoiceSupport": "yes",
    "invoiceNote": "200 元起开电子发票",
    "stabilityScore": "unknown",
    "imageModelSupport": true,
    "channelType": "unknown",
    "channelNote": "",
    "affiliateDisclosure": null,
    "lastVerifiedAt": "2026-07-11T08:00:00Z",
    "lastPriceUpdatedAt": "2026-07-16T08:00:00Z",
    "listedAt": "2026-07-01T00:00:00Z",
    "promoCodes": []
  },
  {
    "id": "demo-relay-kappa",
    "name": "Demo Relay Kappa",
    "website": "https://example.com/kappa",
    "summary": "示例中转站 Kappa，仅用于开发演示。",
    "status": "active",
    "rankWeight": 55,
    "authenticityStatus": "unknown",
    "priceLevel": [
      "low",
      "mid"
    ],
    "payments": [
      "alipay",
      "paypal"
    ],
    "minTopupCny": 5,
    "giftDescription": "注册送体验额度",
    "invoiceSupport": "no",
    "invoiceNote": "",
    "stabilityScore": "excellent",
    "imageModelSupport": false,
    "channelType": "mixed",
    "channelNote": "",
    "affiliateDisclosure": null,
    "lastVerifiedAt": "2026-07-17T08:00:00Z",
    "lastPriceUpdatedAt": "2026-07-16T08:00:00Z",
    "listedAt": "2026-07-01T00:00:00Z",
    "promoCodes": []
  },
  {
    "id": "demo-relay-lambda",
    "name": "Demo Relay Lambda",
    "website": "https://example.com/lambda",
    "summary": "示例中转站 Lambda，仅用于开发演示。",
    "status": "active",
    "rankWeight": 60,
    "authenticityStatus": "pass",
    "priceLevel": [
      "mid"
    ],
    "payments": [
      "alipay",
      "wechat"
    ],
    "minTopupCny": 1,
    "giftDescription": "—",
    "invoiceSupport": "conditional",
    "invoiceNote": "",
    "stabilityScore": "fair",
    "imageModelSupport": true,
    "channelType": "official",
    "channelNote": "",
    "affiliateDisclosure": null,
    "lastVerifiedAt": "2026-07-09T08:00:00Z",
    "lastPriceUpdatedAt": "2026-07-16T08:00:00Z",
    "listedAt": "2026-07-01T00:00:00Z",
    "promoCodes": []
  },
  {
    "id": "demo-relay-mu",
    "name": "Demo Relay Mu",
    "website": "https://example.com/mu",
    "summary": "示例中转站 Mu，仅用于开发演示。",
    "status": "active",
    "rankWeight": 65,
    "authenticityStatus": "pass",
    "priceLevel": [
      "low"
    ],
    "payments": [
      "stripe",
      "usdt"
    ],
    "minTopupCny": 8,
    "giftDescription": "—",
    "invoiceSupport": "yes",
    "invoiceNote": "",
    "stabilityScore": "excellent",
    "imageModelSupport": false,
    "channelType": "mixed",
    "channelNote": "",
    "affiliateDisclosure": null,
    "lastVerifiedAt": "2026-07-16T18:00:00Z",
    "lastPriceUpdatedAt": "2026-07-16T08:00:00Z",
    "listedAt": "2026-07-01T00:00:00Z",
    "promoCodes": []
  }
]
